T20260626-018,Empowering GUI Agents via Autonomous Experience Exploration and Hindsight Experience Utilization for Task Planning,通过自主经验探索和事后经验利用提升 GUI Agent 的任务规划,https://arxiv.org/abs/2606.27330v1,arXiv,S,AI Agent 应用观察,Agent,2026-06-25,2026-06-26,"The paper studies GUI agents for repetitive web tasks and argues that low-level atomic skills do not guarantee high-level planning competence; it proposes PEEU to improve planning via autonomous exploration and hindsight experience.",该论文研究 GUI Agent 的任务规划问题，指出会操作低层按钮不等于具备高层规划能力，并提出通过自主探索和事后经验合成高层训练数据的方法。,帮助读者理解 GUI Agent 落地的关键不是会点击，而是能规划、泛化、处理异常和可复盘。,5,4,4,已核验,不需要,待发布,drafts/xhs_2026-06-26_gui-agent-planning.md,已生成事实核验、草稿和图文素材
T20260627-001,Previewing GPT-5.6 Sol,GPT-5.6 Sol 受限预览,https://openai.com/index/previewing-gpt-5-6-sol/,OpenAI,S,今日值得看,热点,2026-06-26,2026-06-27,"OpenAI announced a limited preview of the GPT-5.6 series, including Sol, Terra, and Luna, with access through API and Codex for select partners.",OpenAI 发布 GPT-5.6 系列受限预览，包括 Sol、Terra、Luna，并向 select partners 开放 API 和 Codex 访问。它的重点不只是新模型能力，而是前沿模型越来越需要同时看开放范围、成本、安全边界和适用任务。,帮助普通职场人和产品运营判断新模型信息该怎么看，避免把受限预览误解为人人可用。,5,4,4,已核验,未实测,待发布,drafts/xhs_2026-06-27_gpt-5-6-limited-preview.md,已生成事实核验、草稿和图文素材
T20260627-002,The Shift to Agentic AI: Evidence from Codex,Codex 证据显示 AI 使用正在转向长任务 Agent,https://arxiv.org/abs/2606.26959,arXiv+本地实测,S,工具实测,工具,2026-06-25,2026-06-27,"The paper analyzes Codex usage and reports growth in concurrent agents, skills, and long-running tasks; this workspace also tested Codex on a multi-file XHS content production workflow.",论文分析 Codex 使用数据，显示并发 Agent、skills 和长任务占比上升。本工作区结合今日内容生产流程，实际测试了 Codex 处理多文件、可校验的图文生产任务。,帮助内容创作者和运营判断长任务该如何交给 AI：用目录、规范、事实核验和验证命令控制风险。,5,4,5,已核验,已实测,待发布,drafts/xhs_2026-06-27_codex-long-task-workflow.md,已生成事实核验、草稿和图文素材
T20260627-003,OpenClaw,OpenClaw 开源个人 AI 助手,https://github.com/openclaw/openclaw,GitHub,S,开源项目拆解,开源,2026-06-27,2026-06-27,"OpenClaw is an open-source personal AI assistant that runs on your devices and connects channels through a local-first gateway with pairing and sandbox guidance.",OpenClaw 是一个开源个人 AI 助手项目，强调运行在用户自己的设备上，通过本地优先网关连接多渠道，并提供配对和沙箱等安全说明。,帮助读者判断个人 Agent 项目值得收藏在哪里、适合谁试，以及部署前必须看清哪些权限和安全边界。,5,4,4,已核验,未实测,待发布,drafts/xhs_2026-06-27_openclaw-personal-ai-assistant.md,已生成事实核验、草稿和图文素材
T20260627-004,Detecting AI Coding Agents in Open Source,在开源中检测 AI 编程 Agent,https://arxiv.org/abs/2606.24429,arXiv,S,AI Agent 应用观察,Agent,2026-06-23,2026-06-27,"The paper studies AI coding agent activity in open source repositories and argues that bot accounts and pull requests miss much of the activity.",该论文研究开源仓库中的 AI 编程 Agent 活动，指出只看 bot 账号或 PR 会漏掉大量 Agent 贡献，很多痕迹存在于提交、配置和元数据里。,帮助工程团队和开源维护者理解 AI 编程 Agent 已进入供应链审查问题，而不只是辅助写代码的效率工具。,5,4,4,已核验,不需要,待发布,drafts/xhs_2026-06-27_ai-coding-agents-open-source.md,已生成事实核验、草稿和图文素材
T20260628-001,OpenAI reveals its first AI processor: Jalapeño,OpenAI 首款自研推理芯片 Jalapeño 曝光,https://www.theverge.com/ai-artificial-intelligence/955939/openai-reveals-its-first-ai-processor-jalapeno,The Verge,B,今日值得看,热点,2026-06-24,2026-06-28,The Verge 报道 OpenAI 展示其首款自研 AI 推理处理器 Jalapeño 并与 Broadcom 合作部署。核心看点不是普通用户能否买到芯片，而是 AI 产品竞争正在进入推理成本、供给和速度层面。,中文说明：这里的 OpenAI、Jalapeño 和 Broadcom 都是报道中的机构或芯片名称，重点不是普通用户购买芯片，而是理解 AI 工具背后的推理算力和成本变化。,帮助普通职场人和产品运营理解：以后 AI 工具的价格、速度、上下文和 Agent 可用性，背后都可能受推理算力供给影响。,4,4,4,已核验,未实测,待发布,drafts/xhs_2026-06-28_openai-jalapeno-inference-chip.md,已生成事实核验、草稿和图文素材
T20260628-002,Hugging Face Daily Papers,Hugging Face Daily Papers 每日论文雷达,https://huggingface.co/papers,Hugging Face+本地实测,S,工具实测,工具,2026-06-26,2026-06-28,Hugging Face Daily Papers 是公开论文发现页面。本次实测用它筛出 OPID、Qwen-Image-Agent、GUI vs CLI 等论文线索；优点是无登录可浏览、聚合速度快，限制是排名和点赞不等于论文质量，必须回到 arXiv、GitHub 或模型卡核验。,中文说明：Hugging Face Daily Papers 是每日论文发现入口，OPID、Qwen-Image-Agent 和 GUI vs CLI 是本次筛选出的英文论文线索，发布前仍需回到论文或代码页面核验。,帮助内容创作者和产品运营建立每日 AI 论文选题雷达，但避免把社区热度当事实。,5,4,5,已核验,已实测,待发布,drafts/xhs_2026-06-28_hf-daily-papers-workflow.md,已生成事实核验、草稿和图文素材
T20260628-003,jinyangwu/OPID,OPID：Agent 训练的事后技能蒸馏框架,https://github.com/jinyangwu/OPID,GitHub+arXiv,S,开源项目拆解,开源,2026-06-25,2026-06-28,OPID 是一个围绕 On-Policy Skill Distillation 的开源项目，论文声称把已完成的 on-policy 轨迹转成分层 hindsight skills，用于提升长程 Agent 任务表现。仓库公开代码和安装说明，但依赖 Python、vLLM、flash-attn、OpenAI-compatible endpoint 和多个评测环境。,中文说明：OPID 是项目名，On-Policy Skill Distillation 可理解为从模型实际任务轨迹中蒸馏技能，hindsight skills 是事后总结出的可复用技能；这些术语用于解释 Agent 训练方法。,帮助轻技术和 Agent 研究读者判断：这类项目适合学习 Agent 训练思路，不适合作为普通办公工具直接上手。,5,3,4,已核验,未实测,待发布,drafts/xhs_2026-06-28_opid-agent-skill-distillation.md,已生成事实核验、草稿和图文素材
T20260628-004,"When Does Combining Language Models Help? A Model-Set Performance Analysis Through the Lens of Co-Failure",多模型组合什么时候有用？从共同失败看模型集合表现,https://arxiv.org/abs/2606.27288,arXiv,S,论文变应用,论文,2026-06-25,2026-06-28,该论文分析 67 个模型和 21 家提供方，提出 co-failure ceiling 共同失败上限。结论是：如果多个模型常在同一问题上失败，简单组合很难超过最佳单模型；模型组合真正有用，前提是不同模型在不同问题上犯错，并且有强查询级路由或验证机制。,中文说明：co-failure ceiling 可理解为共同失败上限，也就是多个模型在同一问题上一起错时，简单组合很难得到正确答案；这对用户意味着不能把多模型一致当成事实证明。,帮助普通用户理解：问多个 AI 得到一致答案，不等于答案更可靠；关键仍然是外部证据、验证器和任务适配。,5,4,5,已核验,不需要,待发布,drafts/xhs_2026-06-28_multi-model-cofailure-ceiling.md,已生成事实核验、草稿和图文素材
T20260628-005,Qwen-Image-Agent: Bridging Context Gaps for Real-World Image Generation,Qwen-Image-Agent：补齐真实生图需求的上下文缺口,https://arxiv.org/abs/2606.26907,arXiv,S,AI Agent 应用观察,Agent,2026-06-25,2026-06-28,Qwen-Image-Agent 论文指出真实生图需求常常缺少上下文，例如隐含知识、实时信息和迭代反馈。该框架把规划、推理、搜索、记忆和反馈接入文生图流程，目标是让生图系统先补齐需求上下文，再生成图像。,中文说明：Qwen-Image-Agent 是论文中的图像生成 Agent 框架，context gaps 可理解为上下文缺口，重点是让生图系统先补齐需求背景、限制和反馈，再执行生成。,帮助内容创作者和产品运营理解：生图 Agent 的价值不只是更会画，而是更会把模糊需求转成可执行视觉方案。,5,4,5,已核验,不需要,待发布,drafts/xhs_2026-06-28_qwen-image-agent-context-gap.md,已生成事实核验、草稿和图文素材
T20260628-006,"GUI vs. CLI: Execution Bottlenecks in Screen-Only and Skill-Mediated Computer-Use Agents",GUI 与 CLI 对比：计算机使用 Agent 的执行瓶颈,https://arxiv.org/abs/2606.24551,arXiv,S,AI Agent 应用观察,Agent,2026-06-23,2026-06-28,该论文比较 screen-only GUI agents 和 skill-mediated CLI agents 在桌面任务中的执行瓶颈。研究显示，GUI Agent 的瓶颈偏向长程交互中的可靠定位、点击和状态恢复；CLI 或技能型 Agent 的瓶颈则偏向技能接口覆盖度和可扩展性。,中文说明：screen-only GUI agents 可理解为只通过屏幕观察和点击操作的图形界面 Agent，skill-mediated CLI agents 可理解为通过命令行或预定义技能执行任务的 Agent；这篇论文帮助判断不同操作型 Agent 适合哪些任务。,帮助产品、运营和轻技术用户理解：做自动化 Agent 不一定要模拟人点屏幕，重复流程更应该沉淀技能、接口和验收器。,5,4,5,已核验,不需要,待发布,drafts/xhs_2026-06-28_gui-cli-agent-bottlenecks.md,已生成事实核验、草稿和图文素材
