T20260625-019,AI - Source,Microsoft AI 资讯源,https://blogs.microsoft.com/ai/,Configured RSS/Web,S,今日值得看,热点,2026-06-25T13:44:24.391Z,2026-06-25,Configured source candidate.,这是 Microsoft AI 资讯入口，用于发现 Copilot、企业 AI 和 Microsoft AI 产品动态。需要打开具体文章确认内容。,适合发现官方更新或高质量行业动态。,5,3,3,待核验,不需要,候选,,
T20260625-020,cs.CL updates on arXiv.org,arXiv cs.CL 更新,https://export.arxiv.org/rss/cs.CL,Configured RSS/Web,S,今日值得看,热点,2026-06-25T13:44:25.518Z,2026-06-25,Configured source candidate.,这是 arXiv 计算语言学分类的更新入口，用于发现 NLP、LLM 和语言技术相关论文。需要筛选具体论文后再发布。,适合发现官方更新或高质量行业动态。,5,3,3,待核验,不需要,候选,,
T20260625-021,cs.AI updates on arXiv.org,arXiv cs.AI 更新,https://export.arxiv.org/rss/cs.AI,Configured RSS/Web,S,今日值得看,热点,2026-06-25T14:01:11.857Z,2026-06-25,Configured source candidate.,这是 arXiv 人工智能分类的更新入口，用于发现 AI 总类相关论文。需要筛选具体论文后再发布。,适合发现官方更新或高质量行业动态。,5,3,3,待核验,不需要,候选,,
T20260626-001,DanceOPD: On-Policy Generative Field Distillation,中文译名待精校：DanceOPD: On-Policy Generative Field Distillation,http://arxiv.org/abs/2606.27377v1,arXiv,S,论文变应用,热点,2026-06-25T17:59:58Z,2026-06-26,"Modern image generation demands a single model that unifies diverse capabilities, including text-to-image (T2I), local editing, and global editing. However, these capabilities are rarely naturally aligned and often conflict. For instance, editing tends to degrade T2I performance, while global and local editing interfere with each other. Consequently, effectively composing these capabilities has become a central challenge for image generation model training. To tackle this, we introduce DanceOPD, an on-policy generative field distillation framework for flow-matching models that routes each sample to one capability field, queries one low-noise student-induced state, and trains with a simple velocity MSE objective. With each capability source defined as a velocity field over the shared flow state space, the student learns from fields queried on its own rollout states to compose expert capabilities. This formulation also absorbs operator-defined fields such as classifier-free guidance. Comprehensive experiments on T2I, editing, realism-field absorption, and CFG absorption show that our approach improves multi-capability composition, strengthening target capabilities while preserving anchor generation quality. We believe this work establishes a practical route for generative field distillation in flow-matching models.",中文摘要待精校：这是一条英文论文摘要，发布前需要翻译为中文并提炼研究问题、方法、结论、适用场景和限制，适合进入“论文变应用”。,适合拆成论文变应用或技术趋势判断。,5,3,3,待核验,不需要,候选,,
T20260626-002,Reinforcement Learning without Ground-Truth Solutions can Improve LLMs,中文译名待精校：Reinforcement Learning without Ground-Truth Solutions can Improve LLMs,http://arxiv.org/abs/2606.27369v1,arXiv,S,论文变应用,热点,2026-06-25T17:59:36Z,2026-06-26,"Reinforcement learning with verifiable rewards (RLVR) for training LLMs typically rely on ground-truth answers to assign rewards, limiting their applicability to tasks where the ground-truth solution is unknown. We introduce a \textbf{R}anking-\textbf{i}nduced \textbf{VER}ifiable framework (RiVER) that trains LLMs on score-based optimization tasks without ground-truth solutions, using deterministic execution feedback as continuous-valued supervision. When applying group-relative RL to such continuous rewards, we identify two key challenges: \emph{scale dominance}, where uncalibrated score magnitudes across test instances distort policy updates, and \emph{frequency dominance}, where repeatedly sampled suboptimal solutions can outweigh rare but stronger candidates. RiVER addresses these challenges with calibrated reward shaping that uses instance-wise comparisons and emphasizes top-ranked solvers while retaining bounded feedback for other valid solutions. We train on 12 AtCoder Heuristic Contest tasks and evaluate on Algorithm Engineering Benchmark (ALE-Bench), LiveCodeBench, and USACO. RiVER advances Qwen3-8B and GLM-Z1-9B-0414 by 8.9\% and 9.4\% in ALE rating rank. More importantly, despite training exclusively on score-based tasks without any ground-truth solutions, RiVER also improves the backbones across exact-solution benchmarks such as LiveCodeBench and USACO by an absolute average improvement of 2.4\% and 3.5\%. By contrast, baselines trained with raw execution scores improve ALE rating but fail to transfer to exact-solution benchmarks. These results suggest that score-based optimization tasks, combined with proper reward calibration, can serve as effective training environments for general coding ability without ground-truth solutions.",中文摘要待精校：这是一条英文论文摘要，发布前需要翻译为中文并提炼研究问题、方法、结论、适用场景和限制，适合进入“论文变应用”。,适合拆成论文变应用或技术趋势判断。,5,3,3,待核验,不需要,候选,,
T20260626-003,Autoregressive Boltzmann Generators,中文译名待精校：Autoregressive Boltzmann Generators,http://arxiv.org/abs/2606.27361v1,arXiv,S,论文变应用,热点,2026-06-25T17:58:21Z,2026-06-26,"Efficient sampling of molecular systems at thermodynamic equilibrium is a hallmark challenge in statistical physics. This challenge has driven the development of Boltzmann Generators (BGs), which allow rapid generation of uncorrelated equilibrium samples by combining a generative model with exact likelihoods and an importance sampling correction. However, modern BGs predominantly rely on normalizing flows (NFs), which either suffer from limited expressivity due to strict invertibility constraints (discrete time) or computationally expensive likelihoods (continuous time). In this paper, we propose Autoregressive Boltzmann Generators (ArBG) -- a novel autoregressive modelling framework -- that overcomes these limitations by departing from the flow-based BG paradigm. ArBG circumvents the topological constraints of flows and enables sequential inference-time interventions, while offering enhanced scalability by leveraging architectures effective in Large Language Models. We empirically demonstrate that ArBG leads to significant improvements over flow-based models across all benchmarks, but particularly in larger peptide systems such as the 10-residue Chignolin. Furthermore, we introduce Robin, a 132 million parameter transferable model trained with the ArBG framework which improves over the previous state-of-the-art, reducing the zero-shot energy error, E-W$_2$, on 8-residue systems by over 60$\%$. The code can be found at the following link: https://github.com/danyalrehman/autobg.",中文摘要待精校：这是一条英文论文摘要，发布前需要翻译为中文并提炼研究问题、方法、结论、适用场景和限制，适合进入“论文变应用”。,适合拆成论文变应用或技术趋势判断。,5,3,3,待核验,不需要,候选,,
T20260626-004,When are likely answers right? On Sequence Probability and Correctness in LLMs,高概率答案什么时候才是对的？关于 LLM 序列概率与正确性的关系,https://arxiv.org/abs/2606.27359v1,arXiv,S,论文变应用,论文,2026-06-25,2026-06-26,"Many decoding methods for large language models can be understood as shifting probability mass toward outputs that are more likely under the model, either locally at the token level or globally at the sequence level. Therefore, their success depends on a fundamental question: when does sequence probability, that is, the conditional probability of a continuation given a prompt, actually align with correctness? In this paper, we set out to quantify this relationship across decoding methods, models, and benchmarks at four levels: across decoding methods, across hyperparameters within a method, across prompt-answer pairs within a dataset, and across repeated responses to the same prompt. We find that higher sequence probability is often predictive of correctness across prompt-answer pairs within a fixed dataset. However, this relationship does not generally transfer to decoding decisions: increasing sequence probability by changing hyperparameters or methods does not reliably improve accuracy. Further, sequence probability is not a good indicator of correctness for responses to the same prompt. These findings clarify when decoding can and cannot be expected to improve correctness, and provide practical guidance for decoding, self-consistency, and verifier-free self-improvement.",该论文研究大模型回答的 sequence probability（序列概率，也就是模型认为整段回答在当前提示下出现的概率）和 correctness（正确性）的关系。结论是：在固定数据集的不同问题之间，高序列概率常常能预测正确性；但通过改解码方法或参数让答案更高概率，并不可靠提升准确率；同一个问题多次回答时，序列概率也不是好的正确性指标。,帮助普通职场人和内容创作者理解：AI 回答越顺、越像标准答案，不等于越可靠；高风险任务要看证据、校验规则和外部事实。,5,4,5,已核验,不需要,待发布,drafts/xhs_2026-06-27_likely-answer-correctness.md,已生成事实核验、草稿和图文素材
T20260626-005,Error-Conditioned Neural Solvers,中文译名待精校：Error-Conditioned Neural Solvers,http://arxiv.org/abs/2606.27354v1,arXiv,S,论文变应用,热点,2026-06-25T17:56:27Z,2026-06-26,"Neural surrogate models offer fast approximate mappings from PDE parameters to solutions, but they typically treat solving as a purely statistical task: once trained, they struggle to correct their own constraint violations and extrapolate beyond the training distribution. Recent hybrid methods promote physical correctness by targeting the PDE residual via gradient descent or Gauss--Newton steps, but inherit the compute cost and instability of the underlying classical optimizers. We show, theoretically and empirically, that numerically minimizing the PDE residual can be an unreliable proxy for reconstruction accuracy in ill-conditioned systems, explaining why these methods often do not make accurate predictions despite achieving low residuals. We propose error-conditioned Neural Solvers (ENS), built on a different principle: rather than an optimization target, the PDE residual field is passed as a direct input to the network at each iteration, enabling it to read the spatial structure of its own errors and learn an update policy to iteratively correct its predictions. Across four PDE families, ENS attains the highest prediction accuracy in the large majority of settings, with gains reaching $10\times$ on turbulent Kolmogorov flow, while avoiding the expensive compute cost of hybrid methods. ENS's learned correction policy generalizes under distribution shift, including zero-shot parameter changes and cross-equation transfer, where its relative advantage is largest in the ill-conditioned regimes where residual minimization is least reliable. Project website: https://neuralsolver.github.io/.",中文摘要待精校：这是一条英文论文摘要，发布前需要翻译为中文并提炼研究问题、方法、结论、适用场景和限制，适合进入“论文变应用”。,适合拆成论文变应用或技术趋势判断。,5,3,3,待核验,不需要,候选,,
T20260626-006,Mapping Political-Elite Networks in Europe with a Multilingual Joint Entity-Relation Extraction Pipeline,中文译名待精校：Mapping Political-Elite Networks in Europe with a Multilingual Joint Entity-Relation Extraction Pipeline,http://arxiv.org/abs/2606.27347v1,arXiv,S,论文变应用,热点,2026-06-25T17:51:59Z,2026-06-26,"Whether political elites organise into rent-seeking coalitions that capture public resources or civic networks that sustain governance is a central question in comparative politics. Yet observing these complex, informal, and adversarial ties at scale has historically required intensive manual coding, while automated text-as-data methods have largely been limited to simple co-occurrence. Recent large language model (LLM) approaches offer a path forward but often rely on proprietary APIs, lack cross-lingual capability, and struggle with scalable entity resolution. We present a modular, fully open-weight pipeline for multilingual joint entity-relation extraction that builds signed, temporal knowledge graphs from massive unstructured news corpora. It combines span-based named-entity recognition (NER) with a three-stage linking cascade mapping mentions to language-independent Wikidata identifiers; a high-throughput, ontology-constrained mixture-of-experts model then uses guided decoding to extract directed, signed relationships grounded in a domain ontology. A full-coverage spot-check against a 3491-relation gold standard shows high textual correctness (68.2% strict to 93.7% lenient). Two large-scale case studies validate the pipeline against the public record. In Austria, it reconstructs a political party's complete lifecycle, dating internal fractures and tracking personnel into successor factions and court convictions. In a Polish corpus, it uncovers the overlapping economic and governance networks of state-enterprise patronage, alongside the structurally balanced, signed conflict network of the polarized Civic Platform (Platforma Obywatelska, PO)--Law and Justice (Prawo i Sprawiedliwość, PiS) duopoly. By bridging raw multilingual text and structured relational data, our framework provides a robust, replicable foundation for cross-national empirical computational social science.",中文摘要待精校：这是一条英文论文摘要，发布前需要翻译为中文并提炼研究问题、方法、结论、适用场景和限制，适合进入“论文变应用”。,适合拆成论文变应用或技术趋势判断。,5,3,3,待核验,不需要,候选,,
T20260626-007,Understanding Domain-Aware Distribution Alignment in Budgeted Entity Matching,中文译名待精校：Understanding Domain-Aware Distribution Alignment in Budgeted Entity Matching,http://arxiv.org/abs/2606.27342v1,arXiv,S,论文变应用,热点,2026-06-25T17:49:48Z,2026-06-26,"Entity Matching (EM) is a core operation in the data integration pipeline, where records from different sources are compared to determine whether they refer to the same real-world entity. Recent work has incorporated domain information and low-resource learning techniques to better adapt EM systems to realistic settings. While these approaches have demonstrated strong performance, it remains unclear how they behave under varying data constraints and levels of supervision in practice. In this paper, we investigate a state-of-the-art method for low-resource, domain-aware EM--BEACON--and study how its performance is affected by different algorithmic choices and data availability conditions. We conduct a series of targeted experiments to evaluate these variations, providing deeper insight into the role of distribution alignment and the behavior of the BEACON framework.",中文摘要待精校：这是一条英文论文摘要，发布前需要翻译为中文并提炼研究问题、方法、结论、适用场景和限制，适合进入“论文变应用”。,适合拆成论文变应用或技术趋势判断。,5,3,3,待核验,不需要,候选,,
T20260626-008,Language-Based Digital Twins for Elderly Cognitive Assistance,中文译名待精校：Language-Based Digital Twins for Elderly Cognitive Assistance,http://arxiv.org/abs/2606.27334v1,arXiv,S,论文变应用,热点,2026-06-25T17:45:53Z,2026-06-26,"Digital twins have emerged as a promising paradigm for personalized healthcare, enabling modeling of individual behavior and health trajectories. In cognitive health, early detection of Mild Cognitive Impairment (MCI) remains challenging, where language and conversational patterns serve as non-invasive biomarkers. In this work, we propose a language-based digital twin framework that leverages large language models (LLMs) to mimic the conversational behavior of elderly individuals by incorporating stylometric cues and contextual metadata. To evaluate fidelity and cognitive consistency, we introduce a multi-head conditional variational autoencoder (cVAE) that jointly measures reconstruction quality and predicts cognitive scores. Experiments on the I-CONECT dataset show that the digital twin preserves identity-specific characteristics and achieves reconstruction and MoCA prediction errors comparable to real data, while outperforming baseline GPT-generated responses. These results highlight the potential of language-based digital twins as a scalable and non-invasive approach for personalized and continuous cognitive health monitoring.",中文摘要待精校：这是一条英文论文摘要，发布前需要翻译为中文并提炼研究问题、方法、结论、适用场景和限制，适合进入“论文变应用”。,适合拆成论文变应用或技术趋势判断。,5,3,3,待核验,不需要,候选,,
T20260626-009,Empowering GUI Agents via Autonomous Experience Exploration and Hindsight Experience Utilization for Task Planning,中文译名待精校：Empowering GUI Agents via Autonomous Experience Exploration and Hindsight Experience Utilization for Task Planning,http://arxiv.org/abs/2606.27330v1,arXiv,S,论文变应用,热点,2026-06-25T17:44:48Z,2026-06-26,"Multimodal web agents can assist humans in operating repetitive GUI tasks, where effective task planning is essential for decomposing complex tasks into executable actions. While small open source MLLMs are cost efficient and privacy preserving compared with commercial large models, they suffer from weak planning and limited cross website generalization. To address these limitations, we introduce the planning experience exploration and utilization (PEEU) method, which autonomously explores environments to discover experiences and utilizes hindsight experience to synthesize strictly aligned, high level training data. To quantitatively analyze the generalization behaviors driving this performance, we propose the task decomposition hierarchical analysis framework (TDHAF) to systematically study compositional generalization across three task granularities: low, middle and high levels. Our analysis reveals that mastering low level atomic skills does not guarantee high level planning competence, while high level task training yields stronger OOD generalization. Experiments on real world benchmarks demonstrate PEEU's superior effectiveness: our 7B model achieves 30.6% accuracy, outperforming the much larger Qwen2.5-VL-32B model. These demonstrate constructing hindsight high level tasks and leveraging experiences is crucial for OOD planning abilities of small MLLMs.",中文摘要待精校：这是一条英文论文摘要，发布前需要翻译为中文并提炼研究问题、方法、结论、适用场景和限制，适合进入“论文变应用”。,适合拆成论文变应用或技术趋势判断。,5,3,3,待核验,不需要,候选,,
T20260626-010,Hallucination in World Models is Predictable and Preventable,中文译名待精校：Hallucination in World Models is Predictable and Preventable,http://arxiv.org/abs/2606.27326v1,arXiv,S,论文变应用,热点,2026-06-25T17:38:45Z,2026-06-26,"Modern generative world models render increasingly realistic action-controllable futures, yet they frequently hallucinate: rollouts remain visually fluent while drifting from the ground-truth dynamics. We hypothesize that hallucination concentrates in low-coverage regions of the state-action space, where lightweight data-centric signals can both detect it and guide mitigation. To test this, we introduce MMBench2, a 427-hour, 210-task dataset for visual world modeling with ground-truth actions, rewards, and live simulators, and train a 350M-parameter world model on it. We identify three distinct hallucination modes: perceptual, action-marginalized, and scene-diverging -- each anchored to a different stage of the pipeline, and develop three signals that accurately predict where the model will fail. To close coverage gaps at training time, we develop a coverage-aware sampling technique; to close them online, our hallucination predictors serve as curiosity rewards for targeted data collection, yielding a data-efficient finetuning recipe that adapts the pretrained world model to entirely unseen environments with as few as 50 real environment trajectories. Overall, our findings reveal that hallucination in world models is inherently a data coverage issue, and that the same signals used to detect it can also be used for mitigation. An interactive web version of our paper is available at https://www.nicklashansen.com/mmbench2",中文摘要待精校：这是一条英文论文摘要，发布前需要翻译为中文并提炼研究问题、方法、结论、适用场景和限制，适合进入“论文变应用”。,适合拆成论文变应用或技术趋势判断。,5,3,3,待核验,不需要,候选,,
T20260626-011,2026-06-25,,https://huggingface.co/papers/date/2026-06-25,Hugging Face,S,论文变应用,热点,2026-06-26T09:38:31.256Z,2026-06-26,Hugging Face Daily Papers candidate.,中文摘要待精校：这条英文信息来自 Hugging Face，发布前需要翻译为中文并说明它讲什么、为什么值得关注、对目标用户有什么意义。,适合发现论文变应用选题。,5,3,3,待核验,不需要,候选,,
T20260626-012,2606.27377,,https://huggingface.co/papers/2606.27377,Hugging Face,S,论文变应用,热点,2026-06-26T09:38:31.256Z,2026-06-26,Hugging Face Daily Papers candidate.,中文摘要待精校：这条英文信息来自 Hugging Face，发布前需要翻译为中文并说明它讲什么、为什么值得关注、对目标用户有什么意义。,适合发现论文变应用选题。,5,3,3,待核验,不需要,候选,,
T20260626-013,2606.27313,,https://huggingface.co/papers/2606.27313,Hugging Face,S,论文变应用,热点,2026-06-26T09:38:31.256Z,2026-06-26,Hugging Face Daily Papers candidate.,中文摘要待精校：这条英文信息来自 Hugging Face，发布前需要翻译为中文并说明它讲什么、为什么值得关注、对目标用户有什么意义。,适合发现论文变应用选题。,5,3,3,待核验,不需要,候选,,
T20260626-014,2606.26907,,https://huggingface.co/papers/2606.26907,Hugging Face,S,论文变应用,热点,2026-06-26T09:38:31.256Z,2026-06-26,Hugging Face Daily Papers candidate.,中文摘要待精校：这条英文信息来自 Hugging Face，发布前需要翻译为中文并说明它讲什么、为什么值得关注、对目标用户有什么意义。,适合发现论文变应用选题。,5,3,3,待核验,不需要,候选,,
T20260626-015,How agents are transforming work,Agent 正在怎样改变工作,https://openai.com/index/how-agents-are-transforming-work/,OpenAI,S,今日值得看,热点,2026-06-25,2026-06-26,OpenAI published an Economic Research article about Codex and agentic work adoption.,OpenAI 发布经济研究文章称 Agentic AI 正在把知识工作从一次问答推向可委托的长任务。文章用 Codex 使用数据说明非开发者和非技术部门也在增加 Agent 使用。但这些数据主要来自 OpenAI 和 Codex 场景，不能直接代表所有公司。,帮助普通职场人判断是否该从单纯学提示词转向学习拆任务、设约束和验收 Agent 产出。,5,4,5,已核验,未实测,待发布,drafts/xhs_2026-06-26_agentic-ai-work-shift.md,已生成事实核验、草稿和 7 页图文素材
T20260626-016,Codex 小红书图文流程实测,Codex 小红书图文流程实测,https://openai.com/index/how-agents-are-transforming-work/,本地实测+OpenAI,S,工具实测,工具,2026-06-26,2026-06-26,"Codex was used in this workspace to rewrite an AI news draft, update factcheck notes, generate source.json, render XHS cards, and run data validation.",本地实测显示，Codex 能辅助完成小红书图文生产中的草稿改写、事实核验清单、结构化源数据和卡片渲染，但不能替代人工选题、事实判断和发布审核。,帮助单人运营者判断 Codex 适合接哪些内容生产步骤，以及哪些步骤必须人工复核。,5,4,5,已核验,已实测,待发布,drafts/xhs_2026-06-26_codex-xhs-workflow-test.md,已生成事实核验、草稿和图文素材
T20260626-017,benchflow-ai/awesome-evals,AI Agent 评测资料库,https://github.com/benchflow-ai/awesome-evals,GitHub,S,开源项目拆解,开源,2026-06-26,2026-06-26,"A curated library of resources for building and evaluating AI agents, including papers, blogs, talks, tools, benchmarks, notes, and a PATTERNS.md playbook.",这是一个面向 AI Agent 构建和评测的 GitHub 资料库，整理论文、博客、演讲、工具、benchmark 和深度笔记，适合产品和工程团队建立 Agent 评测入门地图。,帮助读者从“看 Agent 演示”转向“设计 Agent 评测和验收清单”。,5,4,4,已核验,不需要,待发布,drafts/xhs_2026-06-26_awesome-agent-evals.md,已生成事实核验、草稿和图文素材
